subreddit,text,relevant?
chess,"Does this mean that chess.com could be getting second factor authentication soon?

TOTP 2fa cuts down on the most common source of account hacking ( typically password re-use / credential stuffing ).

Obviously not re-using passwords and using strong passwords with a password manager is also important especially for elevated level users but that's much harder to enforce, humans are lazy creatures and prone to mistakes.

2FA isn't trivial but there are some fairly standard solutions available. Offering (not forcing) 2FA for common users and enforcing 2FA for admin users goes a long way to securing a site from similar things in the future.

If this wasn't credential re-use: were any other accounts compromised and would we be informed if ours were? I am assuming that no account payment information is available to moderators and no such information was leaked during this incident.

A reminder that if any EU accounts were accessed then under GDPR there is 72 hours to disclose this to the information commissioner or similar authority. ( More information for the UK : https://ico.org.uk/for-organisations/guide-to-data-protection/guide-to-the-general-data-protection-regulation-gdpr/personal-data-breaches/ ).",1
wallstreetbets,An idiot because i'm sharing real data and solid information ? Not only personal opinion as you do ? Pls tell me how is wrong to do that and is not wrong to share fake news ?,0
MHOL,"Amendment: 

Strike section 5 

Explanatory Note: 

The NHS Privacy act is a good bill that served to protect the digital data and rights of patients. Section 5 was added as a rider amendment which I as the author do not support. Repealing the NHS Privacy will simply remove the current safeguards we have for protecting the personal privacy of all those who use the NHS and allow large companies to exploit patient data without the consent of the people.",1
uber,"I had security guards ask me to give them a driver's license so they can record my personal information in their employer's database. Some of them disappear into the shack like they're making a scan, not just logging you in.

Um, no, I'll let the next driver do it. Byeee",1
DebunkThis,"NIH stuff is not funded by and can not be funded by outside sources.

You can look up NIH grants - they made entire sections devoted to this problem.

All those peopel have to fill out conflict of interest forms if they get any money from somewhere else.

So if I have an NIH grant for Autism, I still have to declare somewhere that I have another grant from Autism Speaks.  And if I have any other money, like venture capital or anything at all , personally or though the uni, that has to be declared also.

This is no joke and hard to hide and we get audited regularly.  THe NIH is like the IRS but for science.

And I stress again, nobody is funding actual research or data driven things that are not going to make them a profit.

People dont’ fall for weight loss scams because they read a paper about the obesity epidemic.  The people researching the obesity epidemic don’t buy that shit or support it.  People buying that stuff do it because of emotional or cosmetic reasons, or because they are about to lose their foot to diabetes and they are finally listening to the advice of every doctor they ever went to that you can eat sugar frosted high fructose corn syrup puff fries, be sedentary for 23.5 of your 24 hrs etc.

NIH literally has lists of who gets what money publically accessible by law.

And, even if there was one or 2 such studies  funded in that way - there are 100 others funded in the regular way that also say the same thing.

Finally, I have gotten money from drug companies to test their drug that were supposed to be better than another drug in a specific way. It was.  They were good experiments.  You can tell it isn’t bullshit because it is transparent, replicable and it looks exactly like all my other papers testing drugs in that class or novel drugs that were funded by the NIH.",0
wsu,"After accessing the VAERS data, I have decided that I will not be taking the vaccine in the immediate future. 

Look at the VAERS data. Too much of a risk for me. I'm gonna continue to wait and see so that more data is gathered.

I could tell that you are pretty frusturated with me. All I ask is quit alienating me over my personal and medical decision not to take it.

As previously stated, Please, respect my medical decision. My decision should be respected, and not ""clowned"" on as everyone as equal rights, regardless of personal beliefs.",0
TurboGrafx,"Google ""Turbo Graphics dev"". Also recently there was a post here. Yeah, I come from C16 .. and now I do no understand anymore how the 1.8 MHz boost mode worked. I guess that the MOS fab got too good optimizing the 6502 and memory on free market too fast that custom chips from the typically new hires at MOS could not keep up.

Graphic chips typically know far in advance which data they need and thus operate in ""burst"" mode.

Cool introductions to all retro consoles: https://www.copetti.org/writings/consoles/pc-engine/
Confusing details about all the retro consoles: https://www.chibiakumas.com/6502/pcengine.php

Some more details about Mainboard:
https://upload.wikimedia.org/wikipedia/commons/a/a7/NEC-TurboGrafx-16-Motherboard-Top.jpg
 https://www.youtube.com/watch?v=lEN9qtGA8HU

PC engine only needs 8 Data pins to ROM ( but sadly 21 instead of 20 for address ) : http://wiki.pcengine.info/pmwiki.php?n=HuCard.HuCardPinout

Why PC Engine is much like NES: https://nicole.express/2020/personal-computer-engine.html

NES in turn seems to be inspired by https://en.wikipedia.org/wiki/Texas_Instruments_TMS9918#Sprites from 1979
8x8 sprites
more sprites on screen (32) than on scanline (4)

C64 (1982) has 3 color + transparency sprites which NES (1983) copied

I could never make much use of the palette on VGA, so for me it is weird that the PCE engine even has one complete chip just for the palette and a second one for the DAC. And even then they couldn't be bothered to do 4096 colors for some fancy copper sky. Though I think NES is similar and we all appreciate the RGB (via expansion port) and HDMI mods made possible by this.

&gt;The NESRGB board effectively bypasses parts of the PPU - Palette RAM (Color Generator), Decoder, and DAC

Would've been cool if the expansion post would physically be SCART and electrically support just RGB with other pins redefined to support expansions.

Edit: My Bad. VCE has all the video encoding and DAC stuff: https://console5.com/wiki/Hu6260",0
gunpolitics,"&gt; Your not a strong guns advocate... Stop selling yourself in what your not.  At most your a minor gun rights advocate.

Check my Username on Reddit, I have an endless supply of Gun Advocacy Posts. 

https://www.reddit.com/user/the_blue_wizard

But also check out r/idiotswithguns and you will see what I mean. 

Fine if people want to be an idiots in their bedroom making a fool out of themselves waving a gun around fine. But I'm not sure I want those idiots on the streets with guns. Though certainly they can be on the streets with guns with or without my approval, and with or without govt approval. But I would feel more comfortable if I knew everyone was working from the same basic knowledge set. 

But I could potentially say the same thing about cars. Anyone who has ever tried to drive on public roads, knows there are FAR TOO MANY Idiots with Drives License. And that is despite requiring training and proving a minimum of driving ability. I'd like to take a few of them off the road too. 

But I get to have my opinion. CCW should not be a condition of buying a pistol or shooting one in approved places *(private land, public hunting land, private ranges, public ranges, etc...)* 

However CCW is not carrying or shooting a Pistol at a range or on private land, it is carrying a pistol around in public. Dealing with potentially high stress tactical situations. 

Though the context is different, I can make it apply here. To contrast Cars and Guns to people who say you have to do this to drive, but you only have to do this lesser thing to have a gun, I ask people to think about the last time they drove their car, and *How many Cars did you see?* Even in a small town the answer is probably hundreds. Now on that same drive, ask yourself how many Guns you saw? I'm guessing virtually none. Car/Motor Vehicles are used on public roads with hundreds of other drivers, so we need more training and stricter rules. Gun, on the other hand, *over simplifying,* are used in private. They don't need that same level of regulation. And they are a Right. 

However CCW is different, you are now using/carrying that gun in public, and that comes with a higher level of responsibility. And that higher degree of responsibility comes with a higher degree of training. I don't care how many times you watched *""John Wick""* that doesn't qualify you to carry a gun in public. In fact, I would say just the opposite, until you are formally trained, it disqualifies you to carry a gun in public. 

So, I can make a distinction between having and shooting a Gun, and public carrying of a Gun/Pistol - conceal or open carry. Indeed Conceal and Open Carry come with a higher level of responsibility and a higher level of need for training. 

I understand opinions, such as your that are opposite of mine, and like I said, I'm not in Texas, so Texas can do anything it wants. And I know that there are a few other States that are Constitutional Carry. 

And I further understand that Constitutional Carry is Gun Owners blow-back for the ever encroaching infringement of our Rights. And given how far Gun Control has been taken it so far, perhaps it is right to push it strongly in the opposite direction. As an example, if they are going to take it too far to the Left, then perhaps we need to take it too far to the Right just to restore balance. 

I personally think there can be Fact Based Common Sense Gun Laws, but so far *Common Sense and Facts have be wholly lacking in Gun Control.* 

For example the call to ban or severely restrict *Tactical/Sport Rifles* is completely irrational. Averaged over the last 5 years of available data from the FBI, there were 314.6 Rifle Homicides per year. 

But contrast -

- You are 300 TIMES MORE LIKELY to die an ALCOHOL related death than you are to be murdered by a Rifle. (CDC, NIH)
- You are 65 TIMES MORE LIKELY to die of a Gun Related Suicide than to be murdered by a Rifle (FBI, CDC)
- You are 22 TIMES MORE LIKELY to die simply because your DOCTOR has crappy handwriting. (TIME Mag, various)
- You are 10 TIMES MORE LIKELY to DROWN than to be murdered by a Rifle. (CDC, various)
- You are 5 TIMES MORE LIKELY to be murdered with a KNIFE than you are to be murdered by a Rifle. (FBI)
- You are 3.5 TIMES MORE LIKELY to kill yourself than you are to be murdered by a Pistol (FBI, CDC)
- You are 2.7 TIMES MORE LIKELY to be Beaten to Death than to be murdered by a Rifle (FBI)
- You are more likely to DIE USING YOUR CELL PHONE, than you are to be murdered by a Rifle. (NHTSA - distracted driving)
- You are more likely to be STRUCK BY LIGHTNING than to be murdered by a Rifle. In California with the highest number of Rifle Deaths, the odd are still 1 in 1.1 Million compared to 1 in 700,000 to be Struck By Lightning.  (National Geographic, FBI 2019) 
- Medical Malpractices takes the lives of 250,000 people per year. 685 people per Day (John Hopkins, various)
- Rifles about 315/yr (FBI, 5yr avg)
- Tactical/Sport Rifles about 150/yr (various estimates)

So, clearly the hysteria over Rifles and Tactical/Sport Rifles is absolute horse sh!t. But it is sensationalistic, and the Guns look scary, so it is easy to gin up manufactured consent to control them, even though the data does not bear out a need. 

I don't have a problem with ownership of Pistols, or shooting Pistols, but I see Conceal Carry is a different beast with more responsibility, and therefore a greater and surer need for basic training.

And you are free to have the opposite opinion, but I think I have made my position clear, and I leave it to other to weight the information and come to their own informed conclusions, what ever those conclusions might be.",0
explainlikeimfive,"&gt;What. You just used 800 characters to construct a meaningless distinction. Complexity and speed, in the context you are using, are causally linked to each other, rendering the order irrelevant. What a waste of words...

What? Speed and complexity are not the same thing and they aren't even casually linked, more often than not they go in opposite directions in terms of sacrificing speed for complexity or complexity for speed. 

&gt;You've used over a thousand characters and all you have said is ""teeeeeeeeeeeeeeeeeeeeeeeeechnicallllllllllllllllllly, your usage of words is not perfectly accurate"". Which, yea, well, I know. Good job.

But that's the point... You're comparing it to the brain and to intelligence and making grandstanding predictions on how our brain works and whatnot and NONE of that is a given. We don't yet know how our brain works and whether it is a perfectly deterministic system. Some assume that because we also assume that the universe is a deterministic system and we further assume that we are just part of that nature. But that's going deep into philosphy, religion and whatnot. When in reality, for those computer algorithms we'd actually know how they work and we can track all their steps, it's a lot, which makes it difficult but unlike for our brain, it's feasible and due to the lack of complexity not as difficult. 

Also may I remind you that YOU startet the ""teeeeeeeeeeeeeeeeeeeeeeeeechnicallllllllllllllllllly, machine learning is about 'Maaaachiiiiiines' and 'leeeeeeeeeeeeeeeeeeeeeeeeaaarning' and not just computers going through algorithms""? So explaining what a machine actually is and what learning means is kind of necessary if there is such a confusion on terminology.

&gt;Hence, the added ""agent"". But sure. It gets increasingly clear that your biggest issue is improper use of language and has virtually nothing to do with AI of any kind. And I'm not sure that I'm really in the mood for a semantics discussion...

And what is that other than a buzzword? I mean literally an agent is something or someone that is action in an environment. That's all, so it's an application of such a system. 

&gt;Yea... for identifying digits. Good shit. It won't be playing Starcraft though. So... good ... point... I guess?

And playing starcraft is a hard task? I mean there's literally an API for researchers and hobbyists to let their networks play starcraft:
https://news.blizzard.com/en-us/starcraft2/20944009/the-starcraft-ii-api-has-arrived

And that might even be more simple than identifying digits depending on where you get the information. Idk for stuff like chess go and starcraft you have a set of rules and objectives that clearly determine what is working and not working (trial and error) so if you supply it with internal state mechanism and thus give it a more abstract interfact that might even be easier than giving the network a huge pile of pixel colors and hope that it will identify objects. 

Though if you don't give it a nice interface, it has to do the object identification of the pixels in addition to learning to play the game.

Also while apparently google used captchas to develop their OCR (optical character recognition) and while idk all your digital assistance probably record your voice to better their speech recognition and speech generation, I'm talking more about the general pile of data in terms of individual user interaction that they generate daily and that few other entities have access to.

&gt;Why is that the people who whine the most about AI also tend to be the people who get extremely triggered if you so much as suggest that the human brain might not be magic after all? I find that odd. Actually, I don't find it odd at all, but you probably should...

That's completely irrelevant personal opinion.

&gt;Unless we fundamentally change the architecture of how the brain works, it'll still be a deterministic machine and so it isn't doing anything more fancy than what you could do with pen and paper, just a whole lot faster.

Well our brain actually has a different kind of architecture in that all these neurons are somewhat interconnected and feeding into each other in weird way. And if you would want to fully connect each neuron with every other neuron you'd run into technical problems because that growths with the faculty function so n! = n*(n-1)! meaning with 69 nodes you'd already approach a googol (10¹⁰⁰ and yes that is where googles name comes from) which is more connections than there are atoms in the universe and 69 nodes is nothing. So it's impossible to keep such a big system in the memory of even the biggest supercomputer and you'd rather need a botnet of simpler machines which again means you're losing a lot of the initial overview over what is happening and introduce a lot of uncertainties like communication speed, uncertainties of the state of a given machine and so on. And wehther that would end up being a thing with a consciousness similar to ourselfs or remain a deterministic machine, is still up for debate. I mean not that it would be a deterministic machine as we literally built them as such, but the consciousness part and whatnot.",0
chimebank,"To refresh folks' minds on the matter, let's reiterate the following:

Chime **is not** a bank themselves.  Banking ***services*** are provided by The Bancorp Bank (unaffiliated with US Bank) and Stride Bank.  Both financial institutions are insured through FDIC.  

No, Chime does not rely on ChexSystems to determine an applicant's ability to obtain an account.  Often touted as a second-chance bank account, Chime and others like it provide a more robust financial solution compared to prepaid debit cards like American Express Serve.

Often what I've read on these forums (long-time lurker, first-time poster), people who have had negative experiences with Chime fall into one of two categories.  First, it's someone who has co-mingled funds from a business into a Chime account.  This could be the result of a PPP Loan that was taken out.  By default, these ""fintechs"" are going to exercise extreme caution when it comes to these loans.  Sadly, fraud has been committed by multiple individuals and these companies have little alternative when it comes to automatic account closures.  

Before anyone gets their undergarments in a bunch, let me make this point perfectly clear - companies spend significant amounts of money in automation.  When you are dealing with billions of dollars, you want to eliminate the possibility of human error.  Oh, but to err is human, right?  Wrong.  We are a ""woke"" society and now everything from one's preferred pronouns can be taken out of context if referenced incorrectly.  So, remove the human factor and focus on actual metrics.  Those metrics, right or wrong, dictate how these organizations operate.  As I said, they spend significant amounts of money.  And you know what?  They are going to trust that data.  

The other category is one-sided accounts from people who, honestly, know what they did or did not do in order to have their account closed.  There are two sides to every story, and all too often we only get to hear the customer side because that is what this subreddit is all about.  What about the other, corporate side?  Well, you won't get that level of detail because that is personal information private to the account holder and Chime.  So do not blindly trust someone's account of poor treatment by Chime, Varo, N26, or any other ""online bank"".  Ask probing questions, and get the conversation to a meaningful and productive spot.  It's not hard to have civil, public discourse over the internet.  

I've had Chime for 3 years.  In that time I've suspended my account a handful of times because I just felt better with a brick and mortar bank.  Now that I've decided to go full-on with either N26 or Chime, I realize that my use case is quite different than the average banker.  Instead of waiting for a company to say ""your usage is abnormal"", I flat out tell them what I'm going to do with their service.  If it's against the TOS, I'll gladly close my account for you.  I was given an official statement by Chime, which I've archived through time-stamped screenshots from within the app, is that how I plan on using the account is not currently outside of the scope of their TOS.  Does that mean I'm safe forever?  No.  It does mean that at some point the TOS will be updated, and I will have to pay attention for changes which affect my unique use case.",0
CoronavirusUK,"It's not arbitrary though, there is an exact scientific reason for that date which is the opposite of arbitrary. 

Those people that are worried about there jobs have furlough, those people that are worried about there business, should be happy at least we have the best system possible, driven by data and science. If we open up too soon and we don't allow enough time between the steps, we will have to go backwards and possibly close things that do not need to be closed at least this provides more certainty.

It's easy to sit on a sofa and complain just because you want reality to be different, but it still needs to be driven  by data. Yes if your business is under threat you would be screaming for things to open sooner and with that end goal you will use any excuse, i.e case numbers, vaccines etc, but an exact deliberate plan has been set out and there are strong reasons for having that, just because people have personal situations or personal goals that differ or that would benefit from a different course of action, does not suddenly make it the right action.",0
canada,"I work in cybersecurity and I see the complete mess that managing personal data is on a daily basis.

A few years ago, I had to configure the system you're talking about on a computer. While the system itself seemed fine at first glance, the configurations we were told to implement would've allowed any malicious websites to execute code on that computer and compromise it.

I don't mind having physicians access this kind of information, the benefits outweigh the risks. I just don't think random restaurants owners should have access to this information nor deal with this. It opens the door to discrimination and a whole lot of ethical issues. Also, what happens if Quebec decides to implement this and another province doesn't ? Are we just gonna ban people from that province because they don't use the same system?",1
Telegram,"Lie and data manipulation is more evil than fake “privacy” in internet.
And yes, published message is no longer “private”, and must be evidentiary protected against data-trolls like, for exemple, Russian hackers.",1
PERU,"Puse a Bolivia como ejemplo? Solo te digo que si ves los números esta mejor que hace 20 años, que no te guste la data es otra cosa. Me importa muy poco los ejemplos personales pq eso no es una realidad global. Bolivia esta mal? Si. Esta mejor que antes? Tambien si. A pesar de estar mejor que antes, ahora es una potencia económica? No. En ningún momento hay contradicción. Cheka los números duros y refutame, no me des tu opinión.",0
CryptoCurrency,"Hmm, I'm still not really understanding you. It doesn't really come across as rational or reasonable, no offense personally. A ""Mavs database"" is *undoubtedly* 100% less transparent, more prone to fraud, and less accountable - with markedly fewer potential ""smart ticketing"" options.",1
unpopularopinion,"So you are ok letting everyone see and know you have a small penis???? ......cause u don't care about privacy.

Your canned response: 
""np, please pay or offer free service for my data collection like everyone else""

Maaaan u are coooool with everything!! Can't wait to laugh at those pics exposed, and not for ur tiny peter, but your ignorance. 🤣🤣🤣🤣🤣",1
healthcare,"Again, you’re twisting my words. You’re saying I “claimed” things that I never did. I stated there are additional issues that can contribute to the problems the US has with its healthcare system vs other countries. I never stated they were THE reasons. 

Just because you personally don’t see a problem doesn’t mean the problem doesn’t exist. Here’s an excellent article from the [WHO](https://www.euro.who.int/__data/assets/pdf_file/0009/334269/14780_World-Health-Organisation_Context-of-Health_TEXT-AW-WEB.pdf) talking about culture in healthcare. Contrary to popular belief, “white” isn’t a definitive culture. Culture varies and it’s not the same for every white person. Someone who’s Italian will have cultural difference vs someone who is Irish. We are learning more and more in healthcare you can’t treat two people the same way. Even two people of the same ethnicity can have widely different needs. 330 million people with widely different cultures, backgrounds, etc all living together can make healthcare more complicated. 

If I tried to mention everything that creates issues with America’s healthcare system vs other countries we would be here all day, tomorrow and the next day. It’s a very complex problem. I’m super happy for Norway they have a competent healthcare system but they do not have nearly the issues America has to face.",0
