subreddit,text,relevant?
technology,"&gt; paywall....Disable the Js and you won't get the paywall!

A user in a low level hacking forum on Saturday published the phone numbers and personal data of hundreds of millions of Facebook users for free online.

The exposed data includes personal information of over 533 million Facebook users from 106 countries, including over 32 million records on users in the US, 11 million on users in the UK, and 6 million on users in India. It includes their phone numbers, Facebook IDs, full names, locations, birthdates, bios, and — in some cases — email addresses.

Insider reviewed a sample of the leaked data and verified several records by matching known Facebook users' phone numbers with the IDs listed in the data set. We also verified records by testing email addresses from the data set in Facebook's password reset feature, which can be used to partially reveal a user's phone number.

A Facebook spokesperson told Insider that the data was scraped due to a vulnerability that the company patched in 2019.

""A database of that size containing the private information such as phone numbers of a lot of Facebook's users would certainly lead to bad actors taking advantage of the data to perform social engineering attacks [or] hacking attempts,"" Gal told Insider.

Gal first discovered the leaked data in January when a user in the same hacking forum advertised an automated bot that could provide phone numbers for hundreds of millions of Facebook users in exchange for a price. Motherboard reported on that bot's existence at the time and verified that the data was legitimate.

Now, the entire dataset has been posted on the hacking forum for free, making it widely available to anyone with rudimentary data skills.

    —Alon Gal (Under the Breach) (@UnderTheBreach) April 3, 2021

Insider attempted to reach the leaker through messaging app Telegram but did not get a response.

This is not the first time that a huge number of Facebook users' phone numbers have been found exposed online. The vulnerability that was uncovered in 2019 allowed millions of people's phone numbers to be scraped from Facebook's servers in violation of its terms of service. Facebook said that vulnerability was patched in August 2019. 

Facebook previously vowed to crack down on mass data-scraping after Cambridge Analytica scraped the data of 80 million users in violation of Facebook's terms of service to target voters with political ads in the 2016 election.

Gal said that, from a security standpoint, there's not much Facebook can do to help users affected by the breach since their data is already out in the open — but he added that Facebook could notify users so they could remain vigilant for possible
phishing
schemes or fraud using their personal data.

""Individuals signing up to a reputable company like Facebook are trusting them with their data and Facebook [is] supposed to treat the data with utmost respect,"" Gal said. ""Users having their personal information leaked is a huge breach of trust and should be handled accordingly.""",1
movies,"&gt;people have computers and still use them?

Do they though?  I bet the companies doing the design have good data on that.  I haven’t owned a personal desktop or laptop in...12 years?",1
Lyft,"Hi this is not a scam. We ask participants to upload a screenshot of their profile only to verify their identity as a driver to ensure data quality. No personal information such as login, password is required.",1
politics,"I really like the point you’re making because at the end of the day it is an empowering point. You’re trying to empower people and assign them greater amounts of agency in their lives which, as a social worker, I appreciate a lot. I think that speaks highly of your values and your personal ideology. However, it’s just not based in data.  People’s families of origin and contextual backgrounds have gigantic influence on their lives and where they end up.  The predictors are so accurate they’re scary. Now of course we can always point to exceptions to that data and people who do amazing things with the resources they are given - kind of like it sounds like you did with your grit, determination, and good fortune to find strong mentors who helped you out of your situation.  But please understand that being able to point to a handful of exceptions does not make you able to throw out the rest. People like yourself are sadly the exception and we should not make social rules or assumptions based on exceptional examples.  If you want more information about this stuff - such as real research for you to sink your teeth into, please reach out and I’m happy to share it.",0
cookingforbeginners,"You make some good points and ask some good questions. I can't speak to the safety of meat in any other country because I am primarily focused on looking at data in my country of residence but it does seem likely that there are countries with less rigorous slaughtering and meat handling regulations. 

1. To address your first point, you're right to say that using non-running water would reasonably cause less splashing but there's also little to no evidence to say that those other methods are going to actually help significantly reduce the number of bacteria on the surface of your meat.
2. I wouldn't call the practice toxic really, it's just a riskier practice than not washing the meat. There are definitely lots of ways that could potentially spread meat juice around your kitchen! I won't disagree with you there at all but at this point we're talking about a diluted sample of bacteria. There's definitely still bacteria on the cutting board, and bacteria that are going to splash out of the sink with some water while washing your cutting board but this is going to be more dilute and again less risky than the water droplets directly contacting the raw chicken which has a higher number of bacteria. 
3. I can't really speak on this point and this thread has definitely gotten me interested to see if there is research out there on the prevalence of meat washing across different cultures! It could be a good learning experience.
4. There is no meat whatsoever that is guaranteed to be perfectly hygienic especially when raw. Even meat that has been cooked to the proper temperature will likely have bacteria there just not the ones that make us sick (or enough of the ones that make us sick). I haven't really experienced either of those problems personally... there is a slimy layer that can occur on chicken but I just cook the chicken and anecdotally I've never had any issues. However, maybe using something like a paper towel to remove bone chips or something while also patting the chicken dry (which is nice for extra good browning) could be a less risky method of taking care of those issues.
5. That absolutely is a good idea! It's a great idea to clean and sanitize your kitchen surfaces after you've been cooking and everyone should in my opinion, do exactly that. If you are going to wash your meat, I would say that becomes an even more important risk-reduction step. Also, you mention that FDA's advice is not law. That's true and that's not the goal of public health agencies. People do like to say it like it is law and based on the data that we have, it is the best practice to not wash meat. But public health agencies are not here to tell you what to do. They are here to give you all the information that you need to make informed decisions on what you want to do based on who you are as a person and your tolerance for risks. 
6. So this is a really fascinating point and I love that you thought of this! This is very good thinking and this is something that should be studied more! As I mentioned earlier, I would assume that the dilution that comes with each step in the cleaning process would pose less and less of a risk but I don't know that for sure. However, there's a risk with everything! You could apply the same logic to washing your hands. When you first start washing your hands, especially in public restrooms, there's often water that gets splashed around that has touched your dirty hands. Does that pose a risk? Yes. How significant is that risk? Well, it depends and it's complicated! I would recommend to you a podcast called ""Risky or Not?"" which is a short podcast usually less than 10 or 15 minutes which briefly delves into the risk posed by everyday situations!

Anyway, I think you have a great way of thinking and it's important that everyone understands that everything has a degree of risk and that bacteria are literally everywhere but we can take whatever steps we deem necessary (based on things like our risk tolerance) and make our own informed decisions.",0
AskAstrologers,I actually work in data privacy 😀,1
NoMansSkyTheGame,"IIRC, Vy'Keen systems are the ones with the nanite dispensers.

Every space station has an exosuit inventory upgrade station. The anomaly has one as well back next to where you buy exosuit blueprints. That one on the anomaly will reset every time you call the anomoly to a new system. Use this to get 2 inventory slots per system, plus whatever drop pods you can find with charts. Buy some high capacity inventory slots up front. Most items aside from minerals, gasses (stuff that stacks to 9999 by default) will carry at double capacity there. (30 salvaged data instead of 15 in general, for example.)

Get the personal refiner. It's an early game life saver.",0
Libertarian,"No, my point has been that he got shit done, shit that he promised he would. You can call me all you want, but don't call me a liar. I have yet to say anything about ""poor little Trump"". 

I'll have to check you on those numbers, but even then, why the hell would I trust any ""media"" source to tell me how many lies he told? I find it so very unlikely. They know people aren't going to check them on that, they can throw whatever number they want out 95% of people will take it at face value. If anyone goes and finds a discrepancy, they'll just be labeled a liar by the 95% who didn't themselves. That is the reality of our current society. So no, I am not going to go count every lie by every president. I have far better things to do with my time. I doubt you have counted it all yourself, so you are stating a fact I doubt you actually can confirm or deny is true.

So maybe I should have watched my wording. While I do not know if he absolutely did not tell more lies than his predecessors, I find it highly unlikely. I also would be interested to know how many lies were significant lies versus insignificant lies. Many of Trumps lies, that I know of, were over stupid shit. With time I am sure the corruption of the administration will come out, as with any other administration, and I will adjust that view accordingly. 

I did address Trump lying about crowd sizes, but if I didn't specifically state that, yes my talking about all presidents and most government ""leaders"" are habitual and compulsive liars. Equally, I do not know if it is even true, I am taking your word that it is. So no, I will not ""admit"" he was the first president to lie in their first official pronouncement. Quite honestly, that seems incredibly unlikely. What seems far more likely is lazy research looking back, and the fact that the lie Trump told is so obvious. Have you yourself gone back to every single single pronouncement to confirm that what you yourself, once again claiming as absolute fact, is even true? 

I am appreciating that he wasn't the devil that people have made him out to be, not defending him. 90% if people's hate for him is usually based in misinformation or because he said mean things on Twitter. I do not hate liberals, nor do I hate republicans. What I hate are arguments being made with biased or unconfirmed data. It is the root of ignorance. Ignorance is the main driver of the extreme hypocrisy we see every day in today's society. We are all guilty of it at times, including myself, but some more than others. The question is who is willing to see an argument from the other side, and willing to be wrong. 

I have a feeling my understanding of logic is far more firm than yours. I too have noted that you ignored a large majority of points I have made. I also have noted your fragility through needing to attack me personally for disagreeing with you or for not responding to a point that I did in fact respond to. Work on it.",0
CasualConversation,"It wouldn't surprise me. TikTok uses machine learning and data science to suggest videos. It probably found your Internet patterns to be that of someone with ADHD so it suggested videos of it.

Reminds me of the story of the father who would get a weekly mailing list of personalised offers from his local supermarket. He started to get baby stroller and diapers ads. Turned out that his daughter was pregnant and the AI picked up on it before he even did.

And believe me machine learning knows more than just if you're ADHD. But that's definitely why. It's never coincidence with these things.",1
brave_browser,"KYC is a requirement; we don't have a choice here. Keep in mind that when you receive 70% of the revenue for participating in Brave Rewards and Brave Ads, that value comes from the regulated budgets of companies like Amazon, Walmart, and more. Due to anti-money-laundering laws and more, Brave cannot simply facilitate the transfer of real dollars into digital assets dispersed to anonymous entities. That doesn't look good, and we wouldn't remain in business for long 🙂 In this arrangement, we do what we can to make sure your privacy and security are upheld. We don't handle your ID, or the KYC process. Brave actually doesn't get any of your data. And, the entity handling KYC (Uphold, Gemini, Paypal, etc.) doesn't get any of your browsing data—there's a clear separation of concerns and responsibilities. I hope this helps!",1
jailbreak,"The only currently available JBs for your device on that version are unc0ver or Taurine. 

If you want to use unc0ver, you should use version 6.1.1, because there were a bunch of bugs introduced in 6.1.2 that cause the type of issues you mentioned facing. 

Taurine should be fine up to the latest version. 

___

If you go the route of switching, you will need to restore rootfs in unc0ver beforehand. This will remove your tweaks, but keep user data &amp; tweak preferences in place.  After you rejaiibreak, you can reinstall the tweaks you had before and all of your settings will be saved. 

There are a few tweaks that can in theory help with this (the most recent being called “IAmLazy,”) but I haven’t personally tested any of them so I’m not sure how well they work.",0
LoriVallow,"Not an MG sympathizer.  Nor do I have enough concrete evidence at this point to feel as strongly as I do about LV and CD... regarding their roles and guilt.

Had a couple.more thoughts... albeit perhaps not the most riveting.

I do appreciate Annie and her approach to attempting to pull together more info and data.  They are long convos but very insightful for a variety of reasons IMO.

I agree MG is for sure covering her tush.  

The fact that MG is participating is probably a smattering of multiple drivers:

I am sure she does feel guilty and ashamed - after being exposed for her activities with these people.  To what degree,  I have no clue.

I am sure she probably also feels some annoyance for the fact that tbey all ended up in this current state and the house of cards crashed.  I know I'd be pissed if Dateline and other media outlets started hounding me over unsavoury things from my life.

I also think she struggles with some degree of personal conflict with how she actually feels/felt about Chad and Lori.

I think it's possible MG is annoyed to have been part of the click and then may have started getting iced out (to some degree)... so LV and CD could tighten their grib of power and assets.  If not over the group's power...as a best friend.  Perhaps getting annoyed if MG had been Lori's number 1 and got replaced by Chad.  (Hell, I think any ""reasonable human"" would be pissed to have someone take Chad and his garbage priorities over our own.)

It is also entirely possible that MG is 100% in and turned state's evidence to hide in plain sight.  

I am willing to bet the not so talked about peope of their group who remain in the shadows are not all that happy with MG... wouldn't shock me if she has a target hanging over her head.

If this is the case, perhaps she is less sorry than some may want to believe and only trying to stay alive/out of harms way.

I tend to think people did have some plan A and plan B stuff going on... that probably didn't involve MG skipping around giving interviews left and right.

Perhaps a conflict of what she was supposed to do and what someone else, say DW, thinks they should started to pull her into different directions. - Creating the inconsistencies in her stories, etc...

Chad was an idiot... were he and Lori the ""Patsies"" for a larger and more sinister group of individuals?",0
LivestreamFail,"I'm not trained or certified in GDPR compliance, but still work (somewhat) closely with the subject (software engineer in education). I'd love to be corrected if I'm wrong :)

GDPR doesn't care about the reason for processing personal data. I did a quick 30 seconds of googling, as you suggested above, and found that:

&gt;The GDPR can apply in virtually any context, except one.  
&gt;  
&gt;Article 2 of the GDPR states that the GDPR doesn't apply to a ""purely personal or household activity.""

So the argument that Quin is only storing the chat logs for toxicity testing isn't relevant; he's storing personal data, period. And I should clarify ""storing"", because it could well be that's he's not storing the chat logs, but rather just passing it through his black box. But GDPR covers ""processing of personal data"", not just storage, so that doesn't matter.

I don't watch Quin, but let's pretend for a second that I do. When I type in his chat, I'm comfortable with **Twitch** storing my data, because by creating an account on their platform, I've agreed to their privacy notice which outlines how they'll store and use my data, and what I can do to request it (or delete it).

As a viewer, no where have I agreed to a ""Quin privacy notice"" that describes how they intend to use my data, or what I can do to request deletion. Maybe, by agreeing to Twitch's privacy notice, I'm also agreeing to let streamers process my data that's related to them (chat on their streams), but I don't know if that's the case. I'm not going to sit and read through the whole of Twitch's privacy notice.

I'm not too fussed about the whole situation (although I've just wrote a bunch of paragraphs lol); as you mentioned, he's just using it for some dumb filter thing on Twitch chat. But GDPR is here for a reason, and if you start letting people process personal data with disregard for GDPR because it's ""just some dumb thing"", then it could be the start of a slippery slope. What constitutes something dumb enough that GDPR should be quietly ignored? That definition is extremely subjective.",1
BlockedAndReported,"&gt; The part of this I disagree with is that 90% of the writing on cancel culture is RW BS. I don't read RW BS.

Well, you see the obvious contradiction there, right?   You're basically saying you avoid all evidence and therefore by the evidence you personally see the conclusion is false.  Given the rest of your response, I don't think that's exactly what you meant.  I think you're implying that while 90% may or may not be RW BS, you personally don't really deal with that and the remaining 10% is still a lot and well worth contending with and *that's* the stuff you're talking about.   So 90% of *your* data feed and *your* conversation isn't RW BS.  Let me know if I'm reading you wrong.  

And all that may be true, but there's still a stream you swim in.  Dr Seuss and Mr Potato Head may be unimportant to you, but they gained massively more coverage in the mainstream and right-leaning press than did the Harper's Letter or anything J&amp;K have ever written or talked about.   My only point here is that I often hear the complaint that ""I made this reasonable argument and my acquaintances didn't take it seriously"" by people who are completely ignorant of the fact that they accidentally copied the *exact* phrasing that Tucker Carlson has been screaming about for a week.   

All in all, we're not really disagreeing too much I think.   As I said, this definitely isn't 100% a talking point of the right, but any public conversation *does* need to take into account that this *is* a major talking point of the right.   But it's nuanced.  It's wrong to take the right's involvement as an excuse to dismiss all aspects of the issue.  But it's also wrong I think to treat every argument that this may be exaggerated as just dismissing the issue entirely.   There's a lot of room between those two extremes.

&gt; and if we are recalling the same systemic racism and Biden discussion

I was vaguely recalling [this thread](https://old.reddit.com/r/BlockedAndReported/comments/jpuamu/biden_claims_mandate_to_fight_systemic_racism/), but it was really more of a generic statement and a reference to many things.  I definitely didn't have in mind anything from you in particular.",0
Dell,Sounds like a lag in Windows picking up the new data from the embedded controller. Never personally experienced that,1
