subreddit,text,relevant?
NoNewNormal,"The virus is real (I've had it) but its severity is way overblown, and it's being used as a pretext for all kinds of abuse of power by governments, which are in turn corrupt and beholden to tech, pharma and finance companies, which are currently vacuuming up government contract money like pigs at the trough at feeding time. It's kind of like how the Iraq war was started using 9/11 as a flimsy pretext to put in motion things planned for years by neocons with oil and defense contractor connections, except this time the destruction (and opportunity, if you're Bill Gates or Jeff Bezos etc.) is worldwide. The vaccine is being used as another excuse for government tyranny, tech company surveillance of your most intimate personal data, and forced consumption of shoddy pharma products.

I honestly don't know what the conspiracy theory was  in Jan-Feb 2020. I wasn't consuming much news then, and what little I did consume was Democratic primary election news. I only started paying attention to covid19 once San Francisco went into lockdown, and while the virus did scare me for a bit, what the government was doing scared me far more.",1
redditmoment,"&gt;he is not saying that other social medias are better,just the fact that  your data is stored in **china**..think about it,one of the most cruel,censoring goverment out there has your personal data (probably knowing what you like better than you yourself) and your response is ""other social medias are collecting your data too"" oh yeah sure but at very least they respect (to some extend) the data you are giving them and wouldn't just give it out if goverment ask them for it",1
Republican,"Yeah? Well, when they come out with one that isn't riskier than the virus itself I may consider it.

There's never been a working coronavirus vaccine before because they can't make them work like a vaccine should. These gene therapies aren't FDA approved for a reason. Ive watched someone die directly from the first moderna shot. Ive witnessed 2 belles Palsey cases personally. Ive also seen 2 blood clot cases. One that caused a stroke and one that caused a small heart attack. I know of about 30 people that got the virus, myself included. Only one was serious enough to be hospitalized and led to death. She had serious medical conditions beforehand. Oh, and herd immunity doesn't come from the vaccine only.

If people want to get the shot, thats on them. The people that dont want it should have the freedom to make that choice themselves. They definitely should have the opportunity to study the risks and make an educated choice without being shamed or forced into a hasty decision.

Ive been gathering data from everywhere possible to try and understand why people are having such a wide range of serious side effects. So far it looks like the deaths may be blood type related, but it's still too early to know for sure. Its becoming clear that the more severe the covid case the more antibodies people develop and the longer they last. Mild or almost non-existent cases produce very few antibodies that only last weeks. Severe cases that lasted the full 2 weeks and felt like the worst flu case ever seem to produce lots of antibodies that last atleast six months. I'll be keeping a close eye on when those antibodies disappear.

These are just some of the things that should be studied and made known to the public so that we can get a full understanding of what we're dealing with, but its not. We're getting pressured to take a shot that most people dont need, that doesn't provide the immunity it should. We're getting small freedoms dangled from a stick to coax us into making potentially life-altering decisions when none of us know the long term effects. Meanwhile, keeping your own immune system healthy has never entered the equation over the last year. If keeping people healthy was really the concern, things wouldve been handled completely different and our health gurus wouldn't have been lying to us and contradicting themselves the whole time. Ex. Fauci was interviewed the other day and was asked why he contradicted himself every other week last year, and why we should listen to him now? His response was ""I think the American people are *finally ready to hear the truth*"".

People should think about what that statement *really* implies.",0
privacytoolsIO,"Just because you’re not on the scale of facebook, it doesn’t mean that people shouldn’t care. That’s just deflecting. For a user, being able to delete something is better than being able to delete nothing.
The rest of what you say objectively means that you don’t delete data at a user’s request because it is inconvenient for you. As you said, you’re not facebook. In the grand scheme of things, you don’t have much data to deal with. Yes, in the end it’s up to you whether you allow users to delete everything (while respecting all privacy laws), but in principle what you’re doing is laziness at other peoples’ expense.",1
privacy,"That would be great. Only if apple wasn't just lying that they care about your privacy. They are just as bad as any other company (maybe worse because of their dishonesty).

Only thing they probably do is block everyone else from stealing your data, it's only for apple.

People don't care nor know anything about privacy, they just end up believing apple, which is arguably worse than using android and being conscientious about privacy.",1
changemyview,"&gt; I think it’s pretty reasonable to call Uber drivers non-employees... It’s not like they have any kind of exclusivity.

While this is true in practice, Uber has employed a bunch of deceptive tactics to target drivers that use both apps and manipulate them into exclusively using Uber. Their ""[Hell Program](https://www.engadget.com/2017-04-13-uber-hell-program-lyft-drivers.html)"" infringed on their driver's privacy and collected Lyft's driver data and upcoming ride requests via fraud, in an attempt to keep double-appers exclusively on Uber. 

I'd argue that this is strictly unethical, and proves that Uber strictly felt the **need to compete with Lyft for drivers.**",1
privacy,"How does google choosing to use floc cause any new monopolistic entity? Only google is forced to use floc. 

If you are a company that collects data you either get it from google already or have your own websites or services that can collect data. Floc would have no impact unless you opted to implement the floc on those services you owned. Which wouldn’t limit you in competition because google is also going to be doing it. 

The impact of this is on the privacy side. Not the range of companies that can collect data. That limitation existed before the idea of floc or any new methodology.",1
California_Politics,"1) excluding anything for the data that’s out there is harmful regardless if it’s helps you or hurts you. The idea of you being okay with one being removed and not the other really is frightening 

2) well then let’s count every time a bullet is shot though a gun compared to how many of those actually kill some one then. Who cares if it intentional or not if we’re trying to save the most amount of lives tho? Isn’t that the point of banning guns? To save as many lives as possible. 

3) I’m not saying your wrong but for the idea that the only thing some one would practice on would be people or animal shape just shows where your mind set is. I personally don’t use people or animals shape and I know a few other shooters that don’t. Not for any reason but We don’t need a huge target. I’m in California but I actually hardly see people targets ever used.",0
Adguard,Can AdGuard read our browsing data or access our personal files?,1
AmItheAsshole,"Didn't want to write that, OP probably won't confirm or deny for privacy reasons, but the dates and data seem to roughly match up. Not our place to say either way, I assume multiple famous people surf the web under a nickname, just to pretend to normalcy. (Knowing crazy fangirls and stalkers, even with all the money in the world I assume it's not all glitter&amp;gold for many people - heck, some guy even sneaked into Queen Betty's place which I would assume is pretty heavily guarded.) Heck, some of us might have gotten into flame wars with some of them!

At any rate, my judgement is on the thin line between ESH and NAH.",1
oddworld,"Fair enough, didnt realize it was that crazy for the privacy stuff. Still don't mind exclusivity as a concept, but the data collect part isnt great.",1
ledgerwallet,"&gt; That is surprising as I figure most ledger users will have at least a significant amount of understanding with cryptocurrency and the mnemonic recovery system.

You'd be surprised that it is not the case. In fact most Ledger users think that their cryptos are ""in their ledger device"". They treat they ledger with more care than they treat their seed, and often put their ledger in their safe, and lose their seed. That shows you their low understanding of crypto.

&gt; Now that we have addressed the 'vast majority' of cases, I would assume there are a minority of cases where the mnemonic recovery actually fails and the wallet data is lost?

There are a minority of cases that are still unexplained. Hypothesis range from rare firmware failure/bug, rare undetected transmission error on the USB wire, rare bug in some other part of the software chain (chrome libraries, libraries used by desktop apps or browser apps, etc), rare undetected hardware failure on the ledger (e.g. undetected failure on the flash memory) etc... Any hardware of software can have failure points, and even with Checksum and error detection, some errors can remain undetected. Those errors would be caught if the users had done a test-spend from their account or had accessed their account from other devices using the same seed, but in some cases, the users did none of that. I personally make sure to always do that!!

&gt; However, there have been multiple reported cases of BIP39 recovery phrases failing and users losing access to accounts. So it is either, users are the issue, or the hardware is the issue.

In the majority of those cases, this is because the mnemonic is incorrect, e.g. it has one wrong word that got undetected by the BIP39 checksum (the 8-bit checksum only detects 99.6% of word errors). Luckily those cases are very easy to recover using bruteforce methods to find the correct seed (can be done in minutes with the right software tools).

Cases that are still unexplained are extremely rare (I know a couple, some of my clients are in those situations).",0
television,"I’m the same. I know others got cranky with it, but honestly it fit his personality - “i can’t outmanoeuvre you, you’re too big a threat to leave alone, you’ve *just* revealed there’s no database of blackmail material other than the one between your ears...and I do have this gun right here...”",0
sadcringe,"27% of men aged 18-30 are virgins. 28% of men aged 18-30 haven't had sex in a year. That means that 96% of men 18-30 who haven't had sex in a year are virgins. Therefore, you're the exception, not the rule. Also, how is it sensationalist when I write long-form responses that cite statistical metrics? You're cherry picking one thing that I said out of long-form responses to a long-form thread. That's discourse, not sensationalism.

Also, self reporting may have been bad before, but it's still bad now. Unless you have a damn good reason reason why the data should be disregarded, it comes across as ""I don't like this data, so I won't engage with it."" That's pretty anti-intellectual.

You seem like a smart guy though, so I'm confused how you don't see the difference between me saying that we should minimize the rate of sexual assault by dealing with systemic problems like this and saying that sexual assaulters do nothing wrong because of the societal problems. There's a big difference between those two. The fact that there are societal problems that lead to more crime doesn't mean that it's not bad for you personally to do crime.",0
virtualreality,"I think the diffrence is how this collected data is used. Facebook obviosly uses it commercially but also politically (to influence elections for example). The chinese controlled data collected on the other hand is used to determine the social credit score of the civilians, find and exterminate/jail political activists/not overly goverment supportive people or to directly censor their communication. The goverment also gets 0 resistance from the companies so you can't expect any privacy. In the US you still have the secret courts which basically allow and do the same but the goverment has to at least do something before getting the data.

In the end both spy institutions are highly interested in that data and will get it no matter what.",1
CryptoCurrency,"That's necessary for how it works and isn't actually a privacy issue or anything. Google phrase that permission very badly in a way that confuses lots of people.

Certain websites, Uniswap for example, link up to your wallet so you can use it to trade tokens there and then, without having to store them on an exchange first. Reading and changing the content is how it integrates with those websites and displays balances on the pages etc.

At no point is the data it ""reads"" sent to the extension makers or anything like that, it's just the extension itself interacting with the webpages that use it.

This is the same permission adblockers require because they need to be able to see what's on the pages you visit then physically remove the ads.

MetaMask open source and well respected so there's little privacy concern, it's widely agreed that it's very secure too.",1
ledgerwallet,"Transactions have to be done from the actual ledger device. Your crypto can't be stolen remotely unless someone has your seed. And here's the other thing, chances are most of our personal information has already been leaked way before anything at ledger happened. For me it was the Equifax breach that got me and 2/3 of the US exposed. I froze up all my credit and called it a day.

Ledger can certainly have done better on that data breach (you're a security company!) but chances are your information was exposed years before that. Lastly I just upgraded to the nano X if that's any indication about how I feel.",1
SkincareAddiction,"Isn't that how you end up with cults, though? Sticking blindly to a position and refusing to reconsider? 

One good thing she does is admit that she does change her mind with certain products or ingredients, either because more info comes in from data and studies, or because she gave it another chance. I, personally, tend to trust a bit more people who are capable to change their minds when confronted with new information.

Aside from that, she basically has a few hard lines that are very defensible from a dermatological science standpoint (sunscreen is good, fragrance not really, gimmicky ingredients / products meh, it's more the principle of misleading people that matters if they don't do actual harm, etc.) And, as for the rest, she tends to be rather flexible, and I think that's a good thing.

Now, her lifestyle part may not be the healthiest / most balanced content on YouTube, but her personal health issues are no one's concern but her own, I think. And her skincare part is solid. I don't need an expert to be charismatic, and I certainly don't need them to be a role model in every aspect of their life. Even in skincare, no one should be a role model. But there is scientific data to back up most of her skincare positions, and I personally don't need my skincare to be a spa day. I need it to work, not cost an arm and a leg, and not do more harm than good.",0
Gamingcirclejerk,"So the company mishandles user information, has a secret data breach that exposes personal information dating back a year, has a major PR disaster about said move, and the people who use the site who are the victims of all this are just supposed to suck it just so they're not outraged at the same time as ""le peedos""? 

I wonder if even you believe this. I refuse to think any serious person would be asking themselves right now ""GoSh WhY ArE PeoPlE MaD aT ThESe OuTstAnDinG DevEloPErS WhAt a SiCK ComMuNiTY"" while a security research firm who broke the story is telling people to watch their bank accounts. Brains of silly putty, those who must think that.",1
Bitcoin,"hey OP, I reccoment a password manger : https://www.privacytools.io/software/passwords/

They store the URL of sites you log into.  The database is encrypted.  So besides the login and password it has entries for the url and a notes area.",1
scihub,"Hmm, what you describe seems to be exactly what I'm doing. 

I agree that there is selection bias when the researcher (in this case myself) doesn't read through a random sample of relevant papers but picks and chooses sources himself, but I don't see a way around that other than reading EVERYTHING or using a random selector (random selector, however, might lead to missing important info that I personally wouldn't have overlooked).

Could you elaborate what you believe the issues is and what step of my method is problematic and how your method solves it?

&gt; setting criteria for including or excluding the papers (you have to predetermine this and stick to it!).

I mean, this is essentially done through the initial metadata search on crossref, no?

&gt;After short-listing your whole list

Well, that's what I do when I pick the ones that ""sound interesting"" and ""seem useful"" after reading the abstracts and then scanning the conclusions/discussions. What's your process for shortlisting that doesn't create selection bias?

&gt; Librarians on the whole want to share what the library can offer. Many libraries to interlibrary loans and thus you could request them through that means.

Yes, but I think all of us here can agree that this process will slow-down the entire research project. It could be DAYS until the library reads your request, processes the request and sends things to you.",0
germany,"You can't completely ignore cases, because you are risking introducing a bad variant to the world. We also still don't fully understand long term effects. Young people that beat it like a normal flu? They might have long term reduced lung capacity that we don't fully understand just yet.

All that said...I agree with your main point though. Once deaths are reduced and hospitals aren't overrun (due to vaccinating approximately age 50+ or age 60+), I'm not sure there's a great legal argument for restricting all aspects of life anymore. Other than variant fears, it would seemingly be a personal health choice rather than a public health situation at that point.

That's an area I break a bit with German politicians. If deaths remain low, I agree, I'm not sure we need to be screaming red alert and pulling our hair out over the crisis. It would still need to be managed, and people still need to understand you don't want to catch this thing...

We'll see. I bet deaths will start to catch up and the hospitals will remain strained for quite a while. I'm seeing more and more news across the world that ICU's are starting to contain far more young people than they used to. German ICU data is weird too. They say they will get overrun in the near future, but COVID patients actually ""only"" make up 10% of German ICU occupancy. So it kind of seems like ICU capacity is rather full even without COVID. Compare that to Italy where 30% of ICU usage is from COVID, Spain 20%, and France 80%! I think Germany just doesn't at all want to have to tap into ICU reserves, and they maybe don't have enough ICU nurses to keep up. I'm not sure.",0
intj,"Try the Ipip Neo, assuming you haven't used it yet. Take the 300 question test for accuracy.

[https://www.personal.psu.edu/\~j5j/IPIP/ipipneo300.htm](https://www.personal.psu.edu/~j5j/IPIP/ipipneo300.htm)

Please note, this test has nothing to do with MBTI and is entirely a psychological personality test with many different resulting data points to consider that correlate rather well into these 'types' tests.",0
cardano,"I don't think you'd (willingly) be giving your DID key away to anyone. I believe the idea is to use cryptography against your personal data, which (at least in ideal conditions) does not expose this key.

Through cryptography very much like the base chain uses for financial transactions, a DID key could do things like grant another party's key the ability to decrypt specific pieces of personal data. It does this (I would imagine anyway, this is just my notion so take w/ a salt grain or two) by signing certificates that grant such permissions.

This is very similar to the way we (SPOs), for example, use our keys to sign e.g. pool modification certificates to change our pool's parameters like margin, fees, pledge, etc. So this system seems to be an extension of that idea, but for personal data control and sharing.

There are also advertised features for revoking rights to specific permission certificates, which is not a new idea in public key cryptography. PGP has a mechanism for doing this for instance. CAs (certificate authorities that sign off on the integrity of many software programs) also have revokation mechanisms but they work a bit differently than a personal key. A personal key allows an individual to do revokations or authorizations themselves, whereas CAs follow a hierarchical centrally trusted signer model.

I would imagine (hope) that they have also considered the scenario of losing possession of your private key, there is some mentioning of generating a new one and revokation mechanisms would probably allow one to invalidate compromised credentials but I cannot guarantee that this exists in PRISM (even though it probably does) as I don't have first hand knowledge of its detailed workings, just a general understanding of cryptographic techniques and principles.

All in all it sounds promising. I hope this (educated guessing) explanation was helpful for you. :)",1
NoNewNormal,"Because C19 is much more infectious and can be carried asymptomatically much more so. In addition to lockdowns, social distancing and masks causing a huge reduction of the flu, people with the flu will likely stay home when they are sick as they are likely to have symptoms. C19 can spread silently and quickly, but each person is different.

Why this sub think they are ""woke"" and know better than leading virologists and scientists over the world is beyond me. Nobody wanted this. None of us enjoy it. We arent calling for ""restrticting your freedoms"" or wanting you to wear a mask so we can all have a big laugh. People are dying in numbers never seen by the flu. It's like 6x the amount the worst numbers flu has done in a year in the US, and that's WITH the lockdowns and masks and distancing. Even if you assume the flu cases were lumped in, which they werent, it's still 5x. Others have gotten permanent damage to their lungs. This isnt a flu.

I dont know what it is. Maybe everyone in here just doesnt like being told what to do, ever. Maybe your vacation was cancelled and you took it personally? But the delusions in here are real and you guys are literally trying to justify it with a mini echo chamber and cherry picking rare data that suits your rhetoric. Its madness. Chill the fuck out and wear a piece of cloth over your mouth so it doesnt increase infection rates. The fact that this is even a complaint is childish. Literally like a 5 year old throwing a tantrum for not having things exactly they way they want. This is why it's a mandate and not a choice. Too many immature people who cant make the proper decision to do it on their own.",0
DistroTube,"Beep boop, I'm a bot.  
Here's an [Invidious link](https://invidious.xyz/watch?v=8qSeZ7ET7PQ) (a privacy-respecting YouTube alternative) instead! YouTube belongs to Google/Alphabet, an unethical monopoly known to sell private user data, such as your name, address, and phone number to the highest bidder, and for handing it out to unaccountable government surveillance agencies and dubious private firms without thinking twice. [Learn more](https://old.reddit.com/r/privacy/wiki/index)  

[Source Code](https://github.com/GitGangGuy/reddit-privacy-pal) | Reason: ""YouTube"" submission on a whitelisted subreddit",1
AppleMusic,"And also make sure you're not on a phone with an expensive and capped data plan, because you're telling Apple Music to download massive amounts of data in a single stroke, and the resulting bill can hurt. 

I personally don't mind because I can download as much data as I want for free, and most of the time my devices are all on my wifi anyway. :)",1
